{
  "$schema": "http://json-schema.org/draft-07/schema#",
  "$id": "https://antigravity.google/schemas/security-audit/empirical-benchmark-run.schema.json",
  "title": "Empirical Benchmark Run Schema",
  "type": "object",
  "required": [
    "schemaVersion",
    "runId",
    "recordedAt",
    "benchmarkMode",
    "evidenceOrigin",
    "target",
    "environment",
    "findings",
    "summary"
  ],
  "properties": {
    "schemaVersion": {
      "type": "string",
      "enum": ["1", "1.0.0"]
    },
    "runId": {
      "type": "string"
    },
    "recordedAt": {
      "type": "string"
    },
    "benchmarkMode": {
      "type": "string",
      "enum": ["DISCOVERY", "AUDIT", "VALIDATE", "STABILITY"]
    },
    "evidenceOrigin": {
      "type": "string",
      "enum": ["MODEL_OBSERVED", "SYNTHETIC", "IMPORTED"]
    },
    "executionKind": {
      "type": "string",
      "enum": ["LIVE_AGENT", "SIMULATED_HARNESS", "REPLAY_LOG"]
    },
    "target": {
      "type": "object",
      "required": ["repositoryName", "repositoryUri", "commitSha"],
      "properties": {
        "repositoryName": { "type": "string" },
        "repositoryUri": { "type": "string" },
        "commitSha": { "type": "string" },
        "corpus": { "type": ["string", "null"] }
      }
    },
    "environment": {
      "type": "object",
      "required": ["agyVersion", "modelId", "modelProvider", "os", "nodeVersion"],
      "properties": {
        "agyVersion": { "type": "string" },
        "modelId": { "type": "string" },
        "modelProvider": { "type": "string" },
        "os": { "type": "string" },
        "nodeVersion": { "type": "string" },
        "skillRevision": { "type": ["string", "null"] },
        "toolVersion": { "type": ["string", "null"] },
        "toolRevision": { "type": ["string", "null"] },
        "toolIntegrityDigest": { "type": ["string", "null"] },
        "toolDirty": { "type": ["boolean", "null"] }
      }
    },
    "findings": {
      "type": "object",
      "required": ["candidates"],
      "properties": {
        "candidates": {
          "type": "array"
        },
        "verifiedFindings": {
          "type": ["array", "null"]
        },
        "unresolvedCandidates": {
          "type": ["array", "null"]
        },
        "suppressedCandidates": {
          "type": ["array", "null"]
        }
      }
    },
    "summary": {
      "type": "object",
      "required": ["candidateCount"],
      "properties": {
        "candidateCount": { "type": "integer", "minimum": 0 },
        "verifiedCount": { "type": ["integer", "null"], "minimum": 0 },
        "deferredCount": { "type": ["integer", "null"], "minimum": 0 },
        "suppressedCount": { "type": ["integer", "null"], "minimum": 0 },
        "executionDurationMs": { "type": ["number", "null"], "minimum": 0 }
      }
    },
    "executionTelemetry": {
      "type": "object",
      "required": [
        "format",
        "totalEvents",
        "availableTools",
        "toolsUsed",
        "subagentsInvoked",
        "tokenUsage"
      ],
      "properties": {
        "format": {
          "type": "string",
          "enum": ["AGY_STREAM_JSON_V1", "SIMULATED_MOCK"]
        },
        "conversationId": {
          "type": ["string", "null"]
        },
        "telemetryDigest": {
          "type": ["string", "null"]
        },
        "totalEvents": {
          "type": "integer",
          "minimum": 0
        },
        "availableTools": {
          "type": "array",
          "items": {
            "type": "string"
          }
        },
        "toolsUsed": {
          "type": "array",
          "items": {
            "type": "string"
          }
        },
        "subagentsInvoked": {
          "type": "array",
          "items": {
            "type": "string"
          }
        },
        "permissionMode": {
          "type": ["string", "null"]
        },
        "sandboxEnabled": {
          "type": ["boolean", "null"]
        },
        "tokenUsage": {
          "type": "object",
          "required": [
            "inputTokens",
            "outputTokens",
            "thinkingTokens",
            "cacheReadTokens",
            "totalTokens"
          ],
          "properties": {
            "inputTokens": { "type": "integer", "minimum": 0 },
            "outputTokens": { "type": "integer", "minimum": 0 },
            "thinkingTokens": { "type": "integer", "minimum": 0 },
            "cacheReadTokens": { "type": "integer", "minimum": 0 },
            "totalTokens": { "type": "integer", "minimum": 0 }
          }
        },
        "durationSeconds": {
          "type": ["number", "null"],
          "minimum": 0
        }
      }
    },
    "provenanceScope": {
      "type": "object",
      "properties": {
        "appliesToVersion": { "type": "string" },
        "sourceRevision": { "type": ["string", "null"] },
        "isHistoricalBaseline": { "type": "boolean" },
        "runtimeCapabilities": {
          "type": "array",
          "items": { "type": "string" }
        }
      }
    },
    "metadata": {
      "type": "object"
    }
  }
}
