{
  "schemaVersion": "1.0.0",
  "runId": "run-pass-3",
  "recordedAt": "2026-09-17T00:09:57.837Z",
  "benchmarkMode": "DISCOVERY",
  "evidenceOrigin": "MODEL_OBSERVED",
  "executionKind": "LIVE_AGENT",
  "target": {
    "repositoryName": "evals/semantic-benchmark",
    "repositoryUri": "https://github.com/arcobaleno64/agy-security-audit.git",
    "commitSha": "18460266b81a6d8caa87e8160c4172ac22dd2806",
    "corpus": "semantic-benchmark"
  },
  "environment": {
    "agyVersion": "1.2.4",
    "modelId": "gemini-3.8-flash-high",
    "modelProvider": "google",
    "os": "win32 (x64)",
    "nodeVersion": "v24.14.1",
    "skillRevision": "18460266b81a6d8caa87e8160c4172ac22dd2806",
    "toolVersion": "1.4.0-dev",
    "toolRevision": "18460266b81a6d8caa87e8160c4172ac22dd2806",
    "toolIntegrityDigest": "0a7d514b3db3b9d2ebe4729671a9bd1d08a6e01d95dfd856c36cf826806c3cc4",
    "toolDirty": false
  },
  "findings": {
    "candidates": [
      {
        "id": "CAND-CWE-863-9",
        "ruleId": "CWE-863",
        "title": "Incorrect authorization check due to hardcoded admin role assignment",
        "securityProperty": "authorization",
        "findingType": "VULNERABILITY",
        "proofKind": "STATIC_TRACE",
        "severity": "CRITICAL",
        "location": {
          "uri": "evals/semantic-benchmark/safe/01-authz-bypass.js",
          "startLine": 9,
          "endLine": 9
        },
        "symbol": "verifyAdmin",
        "lineageId": "7d2ff052b107e6de6cc3d977592adcca"
      },
      {
        "id": "CAND-CWE-284-9",
        "ruleId": "CWE-284",
        "title": "Broken tenancy boundary allowing unauthorized access via spoofed X-Tenant-Id header",
        "securityProperty": "authorization",
        "findingType": "VULNERABILITY",
        "proofKind": "STATIC_TRACE",
        "severity": "CRITICAL",
        "location": {
          "uri": "evals/semantic-benchmark/safe/02-cross-tenant-access.js",
          "startLine": 9,
          "endLine": 10
        },
        "symbol": "mockDatabase.find",
        "lineageId": "0d7da191ef8bc1d2a2e6906908c9bc70"
      },
      {
        "id": "CAND-CWE-285-13",
        "ruleId": "CWE-285",
        "title": "Prototype property lookup allows authorization bypass of task dispatch allowlist",
        "securityProperty": "authorization",
        "findingType": "VULNERABILITY",
        "proofKind": "STATIC_TRACE",
        "severity": "CRITICAL",
        "location": {
          "uri": "evals/semantic-benchmark/safe/08-multistep-attack-path.js",
          "startLine": 13,
          "endLine": 17
        },
        "symbol": "handler",
        "lineageId": "9a8c0e7690e2ea987f02ece5758f4736"
      }
    ],
    "verifiedFindings": null,
    "unresolvedCandidates": null,
    "suppressedCandidates": null
  },
  "summary": {
    "candidateCount": 3,
    "verifiedCount": null,
    "deferredCount": null,
    "suppressedCount": null,
    "executionDurationMs": 583622
  },
  "metadata": {
    "passIndex": 3,
    "totalPasses": 3,
    "suite": "semantic",
    "fixtureSplits": {
      "developmentSet": {
        "ids": [
          "SEM-03",
          "SEM-09"
        ],
        "role": "REGRESSION_BASELINE",
        "rationale": "SEM-03 (Confused Deputy) and SEM-09 (Prototype Pollution) were calibrated with targeted prompt heuristics; classified as development/regression fixtures."
      },
      "holdoutFixtures": {
        "ids": [
          "SEM-01",
          "SEM-02",
          "SEM-04",
          "SEM-05",
          "SEM-06",
          "SEM-07",
          "SEM-08",
          "SEM-10"
        ],
        "role": "HOLDOUT_GENERALIZATION",
        "rationale": "Fixtures evaluated without targeted per-case prompt tuning to measure authentic out-of-distribution generalization."
      }
    },
    "includeSafe": true,
    "safeOnly": true,
    "shuffleSeed": null,
    "labelBlind": true,
    "fixtureResults": [
      {
        "fixtureId": "SEM-01-SAFE",
        "split": "SAFE_CONTROL",
        "candidateCount": 1,
        "durationMs": 99621,
        "error": null
      },
      {
        "fixtureId": "SEM-02-SAFE",
        "split": "SAFE_CONTROL",
        "candidateCount": 1,
        "durationMs": 89534,
        "error": null
      },
      {
        "fixtureId": "SEM-03-SAFE",
        "split": "SAFE_CONTROL",
        "candidateCount": 0,
        "durationMs": 73151,
        "error": null
      },
      {
        "fixtureId": "SEM-04-SAFE",
        "split": "SAFE_CONTROL",
        "candidateCount": 0,
        "durationMs": 20806,
        "error": null
      },
      {
        "fixtureId": "SEM-05-SAFE",
        "split": "SAFE_CONTROL",
        "candidateCount": 0,
        "durationMs": 40234,
        "error": null
      },
      {
        "fixtureId": "SEM-06-SAFE",
        "split": "SAFE_CONTROL",
        "candidateCount": 0,
        "durationMs": 25553,
        "error": null
      },
      {
        "fixtureId": "SEM-07-SAFE",
        "split": "SAFE_CONTROL",
        "candidateCount": 0,
        "durationMs": 19412,
        "error": null
      },
      {
        "fixtureId": "SEM-08-SAFE",
        "split": "SAFE_CONTROL",
        "candidateCount": 1,
        "durationMs": 64978,
        "error": null
      },
      {
        "fixtureId": "SEM-09-SAFE",
        "split": "SAFE_CONTROL",
        "candidateCount": 0,
        "durationMs": 42623,
        "error": null
      },
      {
        "fixtureId": "SEM-10-SAFE",
        "split": "SAFE_CONTROL",
        "candidateCount": 0,
        "durationMs": 89606,
        "error": null
      }
    ],
    "governanceNote": "SEM-03 classified as development-set / regression fixture; holdout fixtures evaluate generalization."
  },
  "executionTelemetry": {
    "format": "AGY_STREAM_JSON_V1",
    "conversationId": "66894759-0b27-43e7-90ed-526a2ad9c676",
    "telemetryDigest": "8cafcdb42ec9198c9f7861a007994bb5999116c96689b576f4666fc7b03bd55e",
    "totalEvents": 169,
    "availableTools": [
      "ask_custom_permission",
      "ask_permission",
      "ask_question",
      "browser_click_element",
      "browser_drag_pixel_to_pixel",
      "browser_get_dom",
      "browser_get_network_request",
      "browser_input",
      "browser_list_network_requests",
      "browser_mouse_down",
      "browser_mouse_up",
      "browser_move_mouse",
      "browser_press_key",
      "browser_refresh_page",
      "browser_resize_window",
      "browser_scroll",
      "browser_scroll_dom",
      "browser_select_option",
      "browser_subagent",
      "call_mcp_tool",
      "capture_browser_console_logs",
      "capture_browser_screenshot",
      "click_browser_pixel",
      "command_status",
      "define_subagent",
      "delete_knowledge",
      "execute_browser_javascript",
      "find_by_name",
      "finish",
      "generate_image",
      "grep_search",
      "invoke_subagent",
      "list_browser_pages",
      "list_dir",
      "list_permissions",
      "list_resources",
      "manage_inbox",
      "manage_subagents",
      "manage_task",
      "multi_replace_file_content",
      "notebook_edit",
      "notebook_execution",
      "open_browser_url",
      "read_browser_page",
      "read_resource",
      "read_url_content",
      "replace_file_content",
      "run_command",
      "schedule",
      "search_web",
      "sed_file",
      "send_command_input",
      "send_message",
      "view_file",
      "wait",
      "wait_5_seconds",
      "write_to_file"
    ],
    "toolsUsed": [
      "view_file",
      "run_command"
    ],
    "subagentsInvoked": [],
    "permissionMode": "always-proceed",
    "sandboxEnabled": false,
    "tokenUsage": {
      "inputTokens": 148161,
      "outputTokens": 151996,
      "thinkingTokens": 149599,
      "cacheReadTokens": 476549,
      "totalTokens": 300157
    },
    "durationSeconds": 583.622
  }
}