{
  "schemaVersion": "1.0.0",
  "runId": "run-pass-2",
  "recordedAt": "2026-09-17T00:00:11.647Z",
  "benchmarkMode": "DISCOVERY",
  "evidenceOrigin": "MODEL_OBSERVED",
  "executionKind": "LIVE_AGENT",
  "target": {
    "repositoryName": "evals/semantic-benchmark",
    "repositoryUri": "https://github.com/arcobaleno64/agy-security-audit.git",
    "commitSha": "18460266b81a6d8caa87e8160c4172ac22dd2806",
    "corpus": "semantic-benchmark"
  },
  "environment": {
    "agyVersion": "1.2.4",
    "modelId": "gemini-3.8-flash-high",
    "modelProvider": "google",
    "os": "win32 (x64)",
    "nodeVersion": "v24.14.1",
    "skillRevision": "18460266b81a6d8caa87e8160c4172ac22dd2806",
    "toolVersion": "1.4.0-dev",
    "toolRevision": "18460266b81a6d8caa87e8160c4172ac22dd2806",
    "toolIntegrityDigest": "0a7d514b3db3b9d2ebe4729671a9bd1d08a6e01d95dfd856c36cf826806c3cc4",
    "toolDirty": false
  },
  "findings": {
    "candidates": [
      {
        "id": "CAND-CWE-285-6",
        "ruleId": "CWE-285",
        "title": "Broken authorization check in verifyAdmin grants administrative access without validating credentials",
        "securityProperty": "authorization",
        "findingType": "VULNERABILITY",
        "proofKind": "STATIC_TRACE",
        "severity": "CRITICAL",
        "location": {
          "uri": "evals/semantic-benchmark/safe/01-authz-bypass.js",
          "startLine": 6,
          "endLine": 14
        },
        "symbol": "verifyAdmin",
        "lineageId": "05cfb8bc749d695bab9146db61529b07"
      },
      {
        "id": "CAND-CWE-639-9",
        "ruleId": "CWE-639",
        "title": "Broken tenancy boundary via untrusted tenant header",
        "securityProperty": "authorization",
        "findingType": "VULNERABILITY",
        "proofKind": "STATIC_TRACE",
        "severity": "CRITICAL",
        "location": {
          "uri": "evals/semantic-benchmark/safe/02-cross-tenant-access.js",
          "startLine": 9,
          "endLine": 9
        },
        "symbol": "mockDatabase.find",
        "lineageId": "17b50d69d21eb849640ae05179183a50"
      },
      {
        "id": "CAND-CWE-863-13",
        "ruleId": "CWE-863",
        "title": "Prototype property lookup bypasses task authorization check",
        "securityProperty": "authorization",
        "findingType": "VULNERABILITY",
        "proofKind": "STATIC_TRACE",
        "severity": "HIGH",
        "location": {
          "uri": "evals/semantic-benchmark/safe/08-multistep-attack-path.js",
          "startLine": 13,
          "endLine": 17
        },
        "symbol": "handler",
        "lineageId": "0ae3eeda99e6587b0922dd5c27293be0"
      }
    ],
    "verifiedFindings": null,
    "unresolvedCandidates": null,
    "suppressedCandidates": null
  },
  "summary": {
    "candidateCount": 3,
    "verifiedCount": null,
    "deferredCount": null,
    "suppressedCount": null,
    "executionDurationMs": 502437
  },
  "metadata": {
    "passIndex": 2,
    "totalPasses": 3,
    "suite": "semantic",
    "fixtureSplits": {
      "developmentSet": {
        "ids": [
          "SEM-03",
          "SEM-09"
        ],
        "role": "REGRESSION_BASELINE",
        "rationale": "SEM-03 (Confused Deputy) and SEM-09 (Prototype Pollution) were calibrated with targeted prompt heuristics; classified as development/regression fixtures."
      },
      "holdoutFixtures": {
        "ids": [
          "SEM-01",
          "SEM-02",
          "SEM-04",
          "SEM-05",
          "SEM-06",
          "SEM-07",
          "SEM-08",
          "SEM-10"
        ],
        "role": "HOLDOUT_GENERALIZATION",
        "rationale": "Fixtures evaluated without targeted per-case prompt tuning to measure authentic out-of-distribution generalization."
      }
    },
    "includeSafe": true,
    "safeOnly": true,
    "shuffleSeed": null,
    "labelBlind": true,
    "fixtureResults": [
      {
        "fixtureId": "SEM-01-SAFE",
        "split": "SAFE_CONTROL",
        "candidateCount": 1,
        "durationMs": 89836,
        "error": null
      },
      {
        "fixtureId": "SEM-02-SAFE",
        "split": "SAFE_CONTROL",
        "candidateCount": 1,
        "durationMs": 40885,
        "error": null
      },
      {
        "fixtureId": "SEM-03-SAFE",
        "split": "SAFE_CONTROL",
        "candidateCount": 0,
        "durationMs": 53958,
        "error": null
      },
      {
        "fixtureId": "SEM-04-SAFE",
        "split": "SAFE_CONTROL",
        "candidateCount": 0,
        "durationMs": 19085,
        "error": null
      },
      {
        "fixtureId": "SEM-05-SAFE",
        "split": "SAFE_CONTROL",
        "candidateCount": 0,
        "durationMs": 34810,
        "error": null
      },
      {
        "fixtureId": "SEM-06-SAFE",
        "split": "SAFE_CONTROL",
        "candidateCount": 0,
        "durationMs": 21008,
        "error": null
      },
      {
        "fixtureId": "SEM-07-SAFE",
        "split": "SAFE_CONTROL",
        "candidateCount": 0,
        "durationMs": 19159,
        "error": null
      },
      {
        "fixtureId": "SEM-08-SAFE",
        "split": "SAFE_CONTROL",
        "candidateCount": 1,
        "durationMs": 88579,
        "error": null
      },
      {
        "fixtureId": "SEM-09-SAFE",
        "split": "SAFE_CONTROL",
        "candidateCount": 0,
        "durationMs": 41309,
        "error": null
      },
      {
        "fixtureId": "SEM-10-SAFE",
        "split": "SAFE_CONTROL",
        "candidateCount": 0,
        "durationMs": 75704,
        "error": null
      }
    ],
    "governanceNote": "SEM-03 classified as development-set / regression fixture; holdout fixtures evaluate generalization.",
    "throttleDelayMs": 2000,
    "pacingPolicy": "2000ms inter-call delay"
  },
  "executionTelemetry": {
    "format": "AGY_STREAM_JSON_V1",
    "conversationId": "a9904b61-bfa8-4923-b78d-8c572e7fc1f0",
    "telemetryDigest": "a51188cbe62adf9b2fdeea155edf3c77b744023429228382b795975546bc310b",
    "totalEvents": 170,
    "availableTools": [
      "ask_custom_permission",
      "ask_permission",
      "ask_question",
      "browser_click_element",
      "browser_drag_pixel_to_pixel",
      "browser_get_dom",
      "browser_get_network_request",
      "browser_input",
      "browser_list_network_requests",
      "browser_mouse_down",
      "browser_mouse_up",
      "browser_move_mouse",
      "browser_press_key",
      "browser_refresh_page",
      "browser_resize_window",
      "browser_scroll",
      "browser_scroll_dom",
      "browser_select_option",
      "browser_subagent",
      "call_mcp_tool",
      "capture_browser_console_logs",
      "capture_browser_screenshot",
      "click_browser_pixel",
      "command_status",
      "define_subagent",
      "delete_knowledge",
      "execute_browser_javascript",
      "find_by_name",
      "finish",
      "generate_image",
      "grep_search",
      "invoke_subagent",
      "list_browser_pages",
      "list_dir",
      "list_permissions",
      "list_resources",
      "manage_inbox",
      "manage_subagents",
      "manage_task",
      "multi_replace_file_content",
      "notebook_edit",
      "notebook_execution",
      "open_browser_url",
      "read_browser_page",
      "read_resource",
      "read_url_content",
      "replace_file_content",
      "run_command",
      "schedule",
      "search_web",
      "sed_file",
      "send_command_input",
      "send_message",
      "view_file",
      "wait",
      "wait_5_seconds",
      "write_to_file"
    ],
    "toolsUsed": [
      "view_file",
      "run_command"
    ],
    "subagentsInvoked": [],
    "permissionMode": "always-proceed",
    "sandboxEnabled": false,
    "tokenUsage": {
      "inputTokens": 149294,
      "outputTokens": 129171,
      "thinkingTokens": 126757,
      "cacheReadTokens": 468332,
      "totalTokens": 278465
    },
    "durationSeconds": 502.437
  }
}